{
  "$schema": "https://json-schema.org/draft/2020-12/schema",
  "$id": "https://mulgae.local/schemas/mulgae-request-receipt.v1.schema.json",
  "type": "object",
  "additionalProperties": false,
  "required": [
    "schema_version",
    "project_binding",
    "capture_identity",
    "components",
    "request_digest"
  ],
  "properties": {
    "schema_version": {
      "const": "mulgae-request-receipt.v1"
    },
    "project_binding": {
      "type": "string",
      "pattern": "^sha256:[0-9a-f]{64}$",
      "not": {
        "const": "sha256:0000000000000000000000000000000000000000000000000000000000000000"
      }
    },
    "capture_identity": {
      "type": "string",
      "pattern": "^sha256:[0-9a-f]{64}$",
      "not": {
        "const": "sha256:0000000000000000000000000000000000000000000000000000000000000000"
      }
    },
    "components": {
      "type": "object",
      "additionalProperties": false,
      "required": [
        "target_selection",
        "objective",
        "roles",
        "policy",
        "routes",
        "assets",
        "budget",
        "workflow"
      ],
      "properties": {
        "target_selection": {
          "type": "string",
          "pattern": "^sha256:[0-9a-f]{64}$",
          "not": {
            "const": "sha256:0000000000000000000000000000000000000000000000000000000000000000"
          }
        },
        "objective": {
          "type": "string",
          "pattern": "^sha256:[0-9a-f]{64}$",
          "not": {
            "const": "sha256:0000000000000000000000000000000000000000000000000000000000000000"
          }
        },
        "roles": {
          "type": "string",
          "pattern": "^sha256:[0-9a-f]{64}$",
          "not": {
            "const": "sha256:0000000000000000000000000000000000000000000000000000000000000000"
          }
        },
        "policy": {
          "type": "string",
          "pattern": "^sha256:[0-9a-f]{64}$",
          "not": {
            "const": "sha256:0000000000000000000000000000000000000000000000000000000000000000"
          }
        },
        "routes": {
          "type": "string",
          "pattern": "^sha256:[0-9a-f]{64}$",
          "not": {
            "const": "sha256:0000000000000000000000000000000000000000000000000000000000000000"
          }
        },
        "assets": {
          "type": "string",
          "pattern": "^sha256:[0-9a-f]{64}$",
          "not": {
            "const": "sha256:0000000000000000000000000000000000000000000000000000000000000000"
          }
        },
        "budget": {
          "type": "string",
          "pattern": "^sha256:[0-9a-f]{64}$",
          "not": {
            "const": "sha256:0000000000000000000000000000000000000000000000000000000000000000"
          }
        },
        "workflow": {
          "type": "string",
          "pattern": "^sha256:[0-9a-f]{64}$",
          "not": {
            "const": "sha256:0000000000000000000000000000000000000000000000000000000000000000"
          }
        }
      }
    },
    "request_digest": {
      "type": "string",
      "pattern": "^sha256:[0-9a-f]{64}$",
      "not": {
        "const": "sha256:0000000000000000000000000000000000000000000000000000000000000000"
      }
    }
  }
}
